{
  "schemaVersion": "0.1.0",
  "id": "elden-ring",
  "kind": "game",
  "name": "Elden Ring",
  "source": {
    "name": "The Grand Archives",
    "url": "https://github.com/The-Grand-Archives/Elden-Ring-CT-TGA",
    "importMode": "metadata-only",
    "license": "per-repository review required",
    "lastChecked": "2026-08-22"
  },
  "game": {
    "title": "Elden Ring",
    "platforms": ["steam"],
    "storeIds": {
      "steam": "1245620"
    }
  },
  "features": [
    {
      "name": "Cheat table reference",
      "type": "ct-reference",
      "offlineOnly": true,
      "safetyStatus": "requiresManualReview",
      "notes": "Metadata-only link to a public table repository. Offline profile required before any execution support."
    }
  ],
  "safety": {
    "singleplayerOnly": true,
    "offlineOnly": true,
    "multiplayerBlocked": true,
    "reviewStatus": "requiresManualReview"
  },
  "attribution": {
    "required": true,
    "text": "Source metadata references The Grand Archives Elden Ring table repository."
  }
}
