{
  "schemaVersion": "0.1.0",
  "id": "example-game",
  "kind": "game",
  "name": "Example Game",
  "source": {
    "name": "SoloForge Example",
    "url": "https://example.com/soloforge/example-game",
    "importMode": "metadata-only",
    "license": "CC0-1.0",
    "lastChecked": "2026-08-22"
  },
  "game": {
    "title": "Example Game",
    "platforms": ["steam", "gog"]
  },
  "features": [
    {
      "name": "Savegame Backup",
      "type": "save-tool",
      "offlineOnly": true,
      "safetyStatus": "safe",
      "notes": "Copies save files before any local changes."
    },
    {
      "name": "Money Value Finder",
      "type": "memory-scan",
      "offlineOnly": true,
      "safetyStatus": "requiresManualReview",
      "notes": "User-guided scan for a changing integer or float value in an offline singleplayer process."
    }
  ],
  "safety": {
    "singleplayerOnly": true,
    "offlineOnly": true,
    "multiplayerBlocked": true,
    "reviewStatus": "requiresManualReview"
  },
  "attribution": {
    "required": false,
    "text": "Example entry created for SoloForge schema development."
  }
}
